{"$schema":"https://json-schema.org/draft/2020-12/schema","$id":"https://pyrallon.local/contracts/activation-evidence/v2","type":"object","required":["activation_id","release_id","capability_id","evidence_steps","release_hash","signed_by"],"properties":{"activation_id":{"type":"string"},"release_id":{"type":"string"},"capability_id":{"type":"string"},"evidence_steps":{"type":"array","minItems":8,"items":{"enum":["preflight","consent","permit","request","provider_receipt","reconciliation","canonical_mutation","rollback_or_retry"]}},"release_hash":{"pattern":"^[a-f0-9]{64}$","type":"string"},"signed_by":{"type":"string"}},"additionalProperties":false}
